{
  "$schema": "https://json-schema.org/draft/2020-12/schema",
  "title": "HEP Constraints Data",
  "type": "object",
  "additionalProperties": false,
  "required": [
    "model_name",
    "parameters",
    "constraints"
  ],
  "properties": {
    "model_name": {
      "type": "string"
    },
    "model_version": {
      "type": "string",
      "pattern": "^v[0-9]+$"
    },
    "parameters": {
      "type": "array",
      "items": {
        "$ref": "#/$defs/canonical_name"
      }
    },
    "constraints": {
      "type": "array",
      "items": {
        "$ref": "#/$defs/constraint"
      }
    }
  },
  "$defs": {
    "canonical_name": {
      "type": "string",
      "pattern": "^[A-Za-z_][A-Za-z0-9_]*$",
      "not": {
        "enum": [
          "False", "None", "True", "and", "as", "assert", "async", "await",
          "break", "class", "continue", "def", "del", "elif", "else", "except",
          "finally", "for", "from", "global", "if", "import", "in", "is",
          "lambda", "nonlocal", "not", "or", "pass", "raise", "return", "try",
          "while", "with", "yield"
        ]
      }
    },
    "parameter_range": {
      "type": "object",
      "required": [
        "unit"
      ],
      "propertyNames": {
        "anyOf": [
          {
            "const": "unit"
          },
          {
            "$ref": "#/$defs/canonical_name"
          }
        ]
      },
      "properties": {
        "unit": {
          "type": "string",
          "pattern": "\\S"
        }
      },
      "additionalProperties": {
        "anyOf": [
          {
            "type": "array",
            "minItems": 2,
            "maxItems": 2,
            "items": {
              "type": "number"
            }
          },
          {
            "type": "string"
          }
        ]
      }
    },
    "interpolation": {
      "type": "object",
      "additionalProperties": false,
      "required": [
        "file",
        "x_parameter",
        "x_column",
        "x_unit",
        "y_quantity",
        "y_column",
        "y_unit",
        "method",
        "valid_range",
        "extrapolation_policy"
      ],
      "properties": {
        "file": {
          "type": "string",
          "pattern": "^(?!/)(?!.*(?:^|/)\\.\\.(?:/|$))(?!.*\\\\)[A-Za-z0-9_.-]+(?:/[A-Za-z0-9_.-]+)*\\.csv$"
        },
        "x_parameter": {
          "$ref": "#/$defs/canonical_name"
        },
        "x_column": {
          "$ref": "#/$defs/canonical_name"
        },
        "x_unit": {
          "type": "string",
          "pattern": "\\S"
        },
        "y_quantity": {
          "$ref": "#/$defs/canonical_name"
        },
        "y_column": {
          "$ref": "#/$defs/canonical_name"
        },
        "y_unit": {
          "type": "string",
          "pattern": "\\S"
        },
        "method": {
          "enum": [
            "linear",
            "loglog_linear",
            "log_x_linear",
            "log_y_linear"
          ]
        },
        "valid_range": {
          "type": "array",
          "minItems": 2,
          "maxItems": 2,
          "items": {
            "type": "number"
          }
        },
        "extrapolation_policy": {
          "enum": [
            "forbidden",
            "nearest"
          ]
        }
      }
    },
    "computed_by": {
      "oneOf": [
        {
          "type": "object",
          "additionalProperties": false,
          "required": [
            "type",
            "task_id"
          ],
          "properties": {
            "type": {
              "const": "task"
            },
            "task_id": {
              "type": "string",
              "pattern": "^task-[0-9]{3}$"
            }
          }
        },
        {
          "type": "object",
          "additionalProperties": false,
          "required": [
            "type",
            "depends_on_tasks",
            "derivation_note"
          ],
          "properties": {
            "type": {
              "const": "derived"
            },
            "depends_on_tasks": {
              "type": "array",
              "items": {
                "type": "string",
                "pattern": "^task-[0-9]{3}$"
              }
            },
            "derivation_note": {
              "type": "string"
            }
          }
        },
        {
          "type": "object",
          "additionalProperties": false,
          "required": [
            "type",
            "formula"
          ],
          "properties": {
            "type": {
              "const": "parameter_combination"
            },
            "formula": {
              "type": "string"
            }
          }
        },
        {
          "type": "object",
          "additionalProperties": false,
          "required": [
            "type",
            "note"
          ],
          "properties": {
            "type": {
              "const": "external"
            },
            "note": {
              "type": "string"
            }
          }
        }
      ]
    },
    "constraint": {
      "type": "object",
      "additionalProperties": false,
      "required": [
        "id",
        "name",
        "type",
        "observable",
        "source",
        "implementation_status",
        "notes"
      ],
      "properties": {
        "id": {
          "type": "string",
          "pattern": "^c-[0-9]{3}$"
        },
        "name": {
          "type": "string"
        },
        "type": {
          "type": "string",
          "enum": [
            "measurement",
            "upper_limit",
            "lower_limit",
            "allowed_band",
            "ratio"
          ]
        },
        "observable": {
          "$ref": "#/$defs/canonical_name"
        },
        "central_value": {
          "type": "number"
        },
        "uncertainty": {
          "type": "number"
        },
        "sigma": {
          "type": "number"
        },
        "limit_value": {
          "type": "number"
        },
        "limit_value_min": {
          "type": "number"
        },
        "limit_value_max": {
          "type": "number"
        },
        "limit_function": {
          "deprecated": true,
          "type": "string"
        },
        "confidence_level": {
          "type": "number"
        },
        "parameter_range": {
          "deprecated": true,
          "$ref": "#/$defs/parameter_range"
        },
        "interpolation": {
          "$ref": "#/$defs/interpolation"
        },
        "unit": {
          "type": "string",
          "pattern": "\\S"
        },
        "source": {
          "type": "string"
        },
        "implementation_status": {
          "type": "string",
          "enum": [
            "direct",
            "interpolated",
            "manual_only"
          ]
        },
        "notes": {
          "type": "string"
        },
        "computed_by": {
          "$ref": "#/$defs/computed_by"
        }
      },
      "allOf": [
        {
          "if": {
            "properties": {
              "type": {
                "const": "measurement"
              }
            }
          },
          "then": {
            "required": [
              "central_value",
              "uncertainty",
              "sigma"
            ]
          }
        },
        {
          "if": {
            "properties": {
              "implementation_status": {
                "const": "interpolated"
              }
            }
          },
          "then": {
            "required": [
              "unit"
            ],
            "anyOf": [
              {
                "required": [
                  "interpolation"
                ]
              },
              {
                "required": [
                  "limit_function",
                  "parameter_range"
                ]
              }
            ]
          }
        },
        {
          "if": {
            "properties": {
              "type": {
                "enum": [
                  "upper_limit",
                  "lower_limit"
                ]
              }
            }
          },
          "then": {
            "anyOf": [
              {
                "properties": {
                  "implementation_status": {
                    "const": "manual_only"
                  }
                }
              },
              {
                "required": [
                  "limit_value"
                ]
              },
              {
                "required": [
                  "limit_function"
                ]
              },
              {
                "required": [
                  "interpolation"
                ]
              }
            ]
          }
        }
      ]
    }
  }
}
