{
  "model_name": "Toy Numerics Contract Model",
  "model_version": "v1",
  "parameters": [
    "M_Hpp",
    "v_Delta",
    "m_lightest"
  ],
  "constraints": [
    {
      "id": "c-001",
      "name": "Synthetic branching-ratio ceiling",
      "type": "upper_limit",
      "observable": "Br_mu_to_egamma",
      "limit_value": 1e-12,
      "confidence_level": 0.95,
      "unit": "dimensionless",
      "source": "pytest synthetic fixture",
      "implementation_status": "direct",
      "computed_by": {
        "type": "task",
        "task_id": "task-001"
      },
      "notes": "Used by scan and fallback-gate tests."
    },
    {
      "id": "c-003",
      "name": "Synthetic effective-mass ceiling",
      "type": "upper_limit",
      "observable": "m_eff_bb",
      "limit_value": 0.1,
      "confidence_level": 0.95,
      "unit": "eV",
      "source": "pytest synthetic fixture",
      "implementation_status": "direct",
      "computed_by": {
        "type": "parameter_combination",
        "formula": "m_eff_bb compare with synthetic bound"
      },
      "notes": "Natural-language formula intentionally exercises custom-observable fallback."
    },
    {
      "id": "c-005",
      "name": "Synthetic scanned-mass ceiling",
      "type": "upper_limit",
      "observable": "M_Hpp",
      "limit_value": 1000.0,
      "confidence_level": 0.95,
      "unit": "GeV",
      "source": "pytest synthetic fixture",
      "implementation_status": "direct",
      "computed_by": {
        "type": "parameter_combination",
        "formula": "M_Hpp"
      },
      "notes": "Observable is a configured scan parameter, so no runtime formula evaluator is needed."
    },
    {
      "id": "c-006",
      "name": "Synthetic mass-ratio ceiling",
      "type": "upper_limit",
      "observable": "mass_ratio",
      "limit_value": 1.0,
      "confidence_level": 0.95,
      "unit": "dimensionless",
      "source": "pytest synthetic fixture",
      "implementation_status": "direct",
      "computed_by": {
        "type": "parameter_combination",
        "formula": "M_Hpp / 1000.0"
      },
      "notes": "Exercises safe parameter-combination compilation."
    }
  ]
}
